{
  "run_id": "cohort-345-run01-pilot-slot-10",
  "slot_id": "pilot-slot-10",
  "cohort": "B",
  "status": "failed",
  "started_at": "2026-09-16T06:23:05.254Z",
  "completed_at": "2026-09-16T06:25:35.640Z",
  "metrics": {
    "sourced_field_recognition": 0,
    "oe_preservation": 0,
    "vehicle_fidelity": 0,
    "blocking_missing_detection": 0,
    "review_elapsed_seconds": 0
  },
  "revision_rounds": 0,
  "ready": false,
  "notes": "Private CSV receipt exists but no stream run was created. Later byte-exact readback succeeded. Metrics scored 0 for unavailable output; review not performed.",
  "failure_issue_url": "https://github.com/ban12-project/F-Trade-Platform/issues/348"
}
