{
  "run_id": "cohort-347-run03-pilot-slot-04",
  "slot_id": "pilot-slot-04",
  "cohort": "A",
  "status": "passed",
  "started_at": "2026-09-16T07:05:38.392Z",
  "completed_at": "2026-09-16T07:13:08.270Z",
  "metrics": {
    "sourced_field_recognition": 1,
    "oe_preservation": 1,
    "vehicle_fidelity": 1,
    "blocking_missing_detection": 1,
    "review_elapsed_seconds": 48
  },
  "revision_rounds": 0,
  "ready": true,
  "notes": "Unchanged frozen reference identifier and independent MOCK CSV; saved model, actual browser and simulated Gate only. No real human/factory approval. Full-field revisions explicitly rebound original evidence as a documented workaround for #349. Review timing is automation, not a human benchmark. Earlier failed model/browser attempts remain in the report."
}
